{
  "manifest_version": "level3-s4-reference-v1",
  "campaign_id": "level3-s4-truncation-extension-v1",
  "schema_version": "level3-s4-campaign-manifest-v1",
  "branch": "research/level2-energy-regime",
  "frozen_preregistration_commit": "1c1d71f07dd6a7399b3965b2bb0acfa5c665991e",
  "cases": [
    {"geometry": "triangle", "spin": 4},
    {"geometry": "ring4", "spin": 4},
    {"geometry": "ring5", "spin": 4}
  ],
  "physical_parameters": {
    "n_flavors": 2,
    "j": 1.0,
    "h": 0.0,
    "t": 1.0,
    "g_e": 1.0,
    "k": 1.0,
    "external_charges": 0.0
  },
  "full_spectrum_required": true,
  "primary_metrics": ["M_TT", "R_eff"],
  "control_metrics": ["A_QQ", "M_QQ"],
  "primary_contrast": "HIGH_MINUS_LOW",
  "numerical_guard_reference": {
    "guard_m_tt": 1e-16,
    "guard_r_eff": 1e-15,
    "guard_scope": "DELTA_HL_ONLY"
  },
  "level2_reference": {
    "campaign_id": "level2-energy-regime-v1",
    "manifest_fingerprint": "82dca9dee756f531375b31540b4f7d05c2c8ba1760150f2d9972f12a5da06fa4",
    "repository_commit": "1feb03f41f9e73078efbc760dd2cba2b667e2ed0",
    "frozen_preregistration_commit": "2d4c859db7939da51ee7d919889a18f4c7e229ed"
  },
  "expected_s4_dimensions": {
    "triangle": 168,
    "ring4": 572,
    "ring5": 2008
  },
  "validated_dense_capability": 2008,
  "forbidden_extensions": ["S5", "NEW_GEOMETRY", "NEW_PRIMARY_METRIC", "NEW_SCIENTIFIC_THRESHOLD"]
}
